{
  "id": "apple-iphone-16-pro-max",
  "brand": "Apple",
  "model": "iPhone 16 Pro Max",
  "aliases": [
    "Apple iPhone 16 Pro Max",
    "iPhone 16 Pro Max (1TB SG)",
    "iPhone 16 Pro Max (512GB SG)",
    "iPhone 16 Pro Max (1TB USA)",
    "iPhone 16 Pro Max (512GB USA)"
  ],
  "modelNumbers": [],
  "images": {
    "frontOff": "/devices/apple/iphone-16-pro-max.png"
  },
  "status": "published",
  "provenance": [
    {
      "source": "Kaggle: Global Smartphone Database 2025",
      "url": "https://www.kaggle.com/datasets/rajibdab/global-smartphone-database-2025",
      "license": "Apache-2.0",
      "retrievedAt": "2026-08-23"
    }
  ],
  "releaseYear": 2024,
  "family": "iPhone"
}
