{
  "id": "apple-iphone-16-plus",
  "brand": "Apple",
  "model": "iPhone 16 Plus",
  "aliases": [
    "iPhone 16 Plus (256GB SG)",
    "iPhone 16 Plus (512GB USA)",
    "iPhone 16 Plus (256GB USA)"
  ],
  "modelNumbers": [],
  "images": {},
  "status": "draft",
  "notes": "Imported metadata only; requires maintainer review and a final approved asset before publication.",
  "provenance": [
    {
      "source": "Kaggle: Global Smartphone Database 2025",
      "url": "https://www.kaggle.com/datasets/rajibdab/global-smartphone-database-2025",
      "license": "Apache-2.0",
      "retrievedAt": "2026-08-23"
    }
  ],
  "releaseYear": 2024
}
