{
  "id": "xiaomi-poco-x6",
  "brand": "Xiaomi",
  "model": "Poco X6",
  "aliases": ["Poco X6 (12GB RAM)", "Poco X6 (12GB+512GB)"],
  "modelNumbers": [],
  "images": {},
  "status": "draft",
  "notes": "Imported metadata only; requires maintainer review and a final approved asset before publication.",
  "provenance": [
    {
      "source": "Kaggle: Global Smartphone Database 2025",
      "url": "https://www.kaggle.com/datasets/rajibdab/global-smartphone-database-2025",
      "license": "Apache-2.0",
      "retrievedAt": "2026-08-23"
    }
  ],
  "releaseYear": 2024
}
