{
  "id": "xiaomi-poco-f7-pro",
  "brand": "Xiaomi",
  "model": "Poco F7 Pro",
  "aliases": ["Xiaomi Poco F7 Pro"],
  "modelNumbers": [],
  "images": {
    "frontOff": "/devices/xiaomi/poco-f7-pro.png"
  },
  "status": "published",
  "provenance": [
    {
      "source": "Kaggle: Global Smartphone Database 2025",
      "url": "https://www.kaggle.com/datasets/rajibdab/global-smartphone-database-2025",
      "license": "Apache-2.0",
      "retrievedAt": "2026-08-23"
    }
  ],
  "releaseYear": 2025,
  "family": "POCO"
}
