{
  "id": "xiaomi-poco-x3-pro",
  "brand": "Xiaomi",
  "model": "Poco X3 Pro",
  "aliases": ["Poco X3 Pro (8GB+128GB)", "Poco X3 Pro (8GB+256GB)"],
  "modelNumbers": [],
  "images": {},
  "status": "draft",
  "notes": "Imported metadata only; requires maintainer review and a final approved asset before publication.",
  "provenance": [
    {
      "source": "Kaggle: Global Smartphone Database 2025",
      "url": "https://www.kaggle.com/datasets/rajibdab/global-smartphone-database-2025",
      "license": "Apache-2.0",
      "retrievedAt": "2026-08-23"
    }
  ],
  "releaseYear": 2021
}
