{
  "id": "samsung-galaxy-a20s",
  "brand": "Samsung",
  "model": "Galaxy A20s",
  "aliases": ["Galaxy A20s (4GB/64GB)"],
  "modelNumbers": [],
  "images": {},
  "status": "draft",
  "notes": "Imported metadata only; requires maintainer review and a final approved asset before publication.",
  "provenance": [
    {
      "source": "Kaggle: Global Smartphone Database 2025",
      "url": "https://www.kaggle.com/datasets/rajibdab/global-smartphone-database-2025",
      "license": "Apache-2.0",
      "retrievedAt": "2026-08-23"
    }
  ],
  "releaseYear": 2019
}
