{
  "id": "google-pixel-9-pro-fold",
  "brand": "Google",
  "model": "Pixel 9 Pro Fold",
  "aliases": ["Google Pixel 9 Pro Fold", "Pixel 9 Pro Fold (512GB)"],
  "modelNumbers": [],
  "images": {
    "frontOff": "/devices/google/pixel-9-pro-fold.png",
    "thumbhash": "AwiCBQASWHiPiInXqGNPC9mD9+d4d4929w=="
  },
  "status": "published",
  "provenance": [
    {
      "source": "Kaggle: Global Smartphone Database 2025",
      "url": "https://www.kaggle.com/datasets/rajibdab/global-smartphone-database-2025",
      "license": "Apache-2.0",
      "retrievedAt": "2026-08-23"
    }
  ],
  "releaseYear": 2024,
  "family": "Pixel"
}
