{
  "id": "xiaomi-11-lite-5g-ne",
  "brand": "Xiaomi",
  "model": "11 Lite 5G NE",
  "aliases": ["11 Lite 5G NE (8GB/256GB)", "11 Lite 5G NE (8GB RAM)"],
  "modelNumbers": [],
  "images": {},
  "status": "draft",
  "notes": "Imported metadata only; requires maintainer review and a final approved asset before publication.",
  "provenance": [
    {
      "source": "Kaggle: Global Smartphone Database 2025",
      "url": "https://www.kaggle.com/datasets/rajibdab/global-smartphone-database-2025",
      "license": "Apache-2.0",
      "retrievedAt": "2026-08-23"
    }
  ],
  "releaseYear": 2021
}
