{
  "id": "apple-iphone-6s-plus",
  "brand": "Apple",
  "model": "iPhone 6S Plus",
  "aliases": ["iPhone 6S Plus (32GB ROM)", "iPhone 6S Plus (128GB)"],
  "modelNumbers": [],
  "images": {},
  "status": "draft",
  "notes": "Imported metadata only; requires maintainer review and a final approved asset before publication.",
  "provenance": [
    {
      "source": "Kaggle: Global Smartphone Database 2025",
      "url": "https://www.kaggle.com/datasets/rajibdab/global-smartphone-database-2025",
      "license": "Apache-2.0",
      "retrievedAt": "2026-08-23"
    }
  ],
  "releaseYear": 2015
}
